,title,author,day,genre,story,platform,Thumbnail
138,테이밍 마스터,ARC,토,학원/판타지,"전 세계에서 가장 인지도 높은 VR 가상현실 게임 카일란 . 가상현실학과에서도 유명한 자타공인의 게임 폐인 이안. 서버에서 순위권에 드는 궁수로서 남부러울 것 없는 그가 우연히 획득하게 된 히든 클래스로의 전직을 위해 주위의 반대를 무릅쓰고 93레벨의 캐릭터를 과감히 삭제한다. 그가 선택한 것은 카일란 최고의 노답 직업인 소환술사? 엎친 데 덮친 격으로 F학점을 피하려면 두 달 안에 삭제한 캐릭터의 레벨까지 올려야 하는데 100렙까지는 1년이 걸린다는 극악의 레벨업을 자랑하는 카일란에서 불과 두 달만에 93레벨을 찍기 위한 그의 고군분투가 펼쳐지는데... 레벨 업을 향해 더 빨리, 더 철저하게, 더 끈질기게 테이밍 마스터 의 전설이 시작된다!",카카오웹툰,https://kr-a.kakaopagecdn.com/P/C/2433/c2/2x/02579673-03f0-4384-bc8b-f47527b452a5
139,메디컬 환생,키다리스튜디오,토,판타지 드라마,"실패한 외과 의사로서의 삶을 살던 김진현, 우연한 사건으로 인해 환생의 기회를 얻는다. 그리고 돌아간 시점은 중학생 김진현의 모습. 새로 얻은 삶의 기회를 소중히 여기고 악착같이 공부하는 진현. 이번 삶의 목표는 힘들고 돈도 못 버는 외과의가 아니라 돈 많이 버는 피부과 의사다!",카카오웹툰,https://kr-a.kakaopagecdn.com/P/C/2347/c2/2x/a8fcd3d6-3dfc-498c-a0be-07096daa1c9e
140,나 혼자 소설 속 망나니,알그,토,학원/판타지,"매일 같은 야근으로 밤을 새던 도중, 잠깐 잠이 들었다 일어났더니 읽고 있던 웹 소설의 악역에 빙의했다? 뭐, 흔한 클리셰지. 정해진 운명에 따르면 내가 죽게 된단 것까지. 젠장. 방법을 찾아야 한다. 소설 속 망나니 악역에 빙의해서 살아남는 방법 첫 번째. 내 편을 많이 만든다. 소설 속 망나니 악역에 빙의해서 살아남는 방법 그 두 번째. 내 한 몸은 지킬 수 있을 만큼 강해진다. 소설 속 망나니 악역에 빙의해서 살아남는 방법 마지막 세 번째. 저 자존심 강한 미친 귀환자랑은 절대로 친해지지 않는다. 그런데 어째? 이미 빙의하기 전, 원래 몸의 주인이 이미 사고를 쳐놨는 걸. 돈을 써서 아직 힘을 되찾지 못한 귀환자를 죽이면 되지 않냐고? 미쳤어? 그럼 마왕은 누가 막아? 최강이 되기보다 편안하게 살고 싶은 악역 최유성의 현대 생존 레이드 빙의 판타지 ? 가 시작된다!",카카오웹툰,https://kr-a.kakaopagecdn.com/P/C/2409/c2/2x/31de244b-a974-46f5-a66a-b25a870c51d6
141,너의 의미,예영,토,로맨스 판타지,"매일이 고된 직장 생활로 번아웃이 온 다연은 어느 날 낯선 세상에서 눈을 뜨게 된다. 하루하루 무기력하게 보내는 그녀에게 닥쳐온 시련이 있었으니... 신계의 사람들은 죄다 폐인 뿐이란 말이냐?! 미모부터 열일하는 근명성실 황제, 미하일. 죄송하지만 이번 생은 안 될 것 같아요. 아마 그 다음생도... 격렬하게 아무것도 하기 싫은 신녀, 다연. 무기력 신녀와 잔소리꾼 황제의 갱생 ? 힐링 로맨스!",카카오웹툰,https://kr-a.kakaopagecdn.com/P/C/2449/c2/2x/19188d59-f4e0-4a97-8ab1-374ab44ce975
142,남장 비서,버선버섯,토,로맨스,"사고를 당한 남동생을 대신해 대기업 엘른 에 남장을 한 채 부사장 이강준의 비서로 일하게 된 서원은 입사하자마자 산업 스파이로 몰리게 되고, 누명을 벗기 위해 고군분투한다. 가뜩이나 스파이 찾기만 해도 바쁜 와중에 자신을 남자로 알고 있으면서도 욕망을 내보이는 부사장 강준과, 항상 웃는 얼굴 때문에 속을 알 수 없는 이사 동진까지 얽혀버렸다. 서원은 이런 상황에서 스파이 누명도 벗고, 끝까지 여자인 걸 숨길 수 있을까?",카카오웹툰,https://kr-a.kakaopagecdn.com/P/C/2474/c2/2x/6a04c390-715d-4318-8f8b-d7a563ebfb11
143,흔한 환생녀의 사정,풀모,토,로맨스 판타지,흔한 환생녀 발레리의 철벽 로맨스!,카카오웹툰,https://kr-a.kakaopagecdn.com/P/C/1928/c2/2x/c259f4fa-9a84-4122-a141-be20d1e4b4de
144,아이딘,명랑,토,로맨스 판타지,공작가의 영애이자 황제의 직속 암살단인 부엉이 의 단장 아이딘. 자신의 주군인 레이몬드에게 기만당해 모든 죄를 뒤집어 쓴 채 처형당하고 만다. 5년 전으로 회귀한 그녀는 그에게 복수를 다짐하며 페르디 제국을 무너뜨리기로 결심하고 적국인 젤디온에 화친의 목적으로 가게 되지만 그곳에서 뜻밖의 운명이 뒤틀리고 마는데,카카오웹툰,https://kr-a.kakaopagecdn.com/P/C/2444/c2/2x/ef9b737f-8c7c-444f-8388-ffdf7792e053
145,에보니,"네이다, REDICE STUDIO",토,로맨스 판타지,"아버지와 약혼자를 살해한 패륜 종속 살인마, 에보니 보냐크. 사형선고를 받고 죽을 날만 기다리고 있던 그녀는 어느날 자신에게 후견인이 생겼다는 소식을 듣고 석방되어 대공의 성으로 보내지게 되는데... 자, 어서 발을 넣어요. 너무 뜨거우면 말하고. 지하에 감금당하거나 쥐도 새도 모르게 죽임을 당할 거라고 생각했다. 하지만 그녀를 기다리고 있는 건 너무나 상냥한 저택의 고용인들. 그리고. 에보니 보냐크, 너는 노예인가? 왜 너 자신에 대한 소유권을 주장하지 않지? 자꾸만 그녀의 마음을 건드리는 수상한 대공 단테 보르드 슈나이더. 그로 인해 에보니의 삶은 변하기 시작하는데...",카카오웹툰,https://kr-a.kakaopagecdn.com/P/C/2348/c2/2x/d5f9569b-e06b-42ae-8254-0eae4d11808b
146,전생자,차용운,토,판타지 드라마,"시간 역행을 하시겠습니까? 모든 능력이 리셋 됩니다. 날짜를 선택 하여 주십시오. 1985년 2월 28일. 내가 태어났던 날로. 금력 , 세계의 돈을 긁어모은다. 독점 , 세계의 던전을 독차지한다. 아직 평화로운 세상, 바로 이 시절에서.",카카오웹툰,https://kr-a.kakaopagecdn.com/P/C/2353/c2/2x/ffcc74b3-db33-4483-9817-56202442abb8
147,아파도 하고 싶은,김인정,일,로맨스,"그 를 아주 오랫동안 짝사랑해왔다. 하지만, 그에게 하연은 여자가 아니었다. 좋게 봐야 같은 동아리 후배, 더 나아가서는 같은 직장에 다니는 여자애. 그냥 그 정도. 그랬던 그가 결혼을 한다? 선봐서 곧 결혼할 거야. 되도록 이른 시일 내에. 모르는 여자와의 계약 결혼을 할거라는 남자의 말에 하연은 오랫동안 간직했던 감정을 억누르지 못했다. 꼭 하셔야 한다면 . 저랑 해요, 그 결혼. 서투룬 유혹, 남자의 단단한 등에 매달려 뜨거운 입술을 겹쳤다. 발칙한 후배의 도발. 선배는 화를 낼까. 아니면 미쳤다고 비웃을까. 그러나 남자의 입에서 나온 말은 예상외의 것이었다. 할 거면 제대로 해야지.",카카오웹툰,https://kr-a.kakaopagecdn.com/P/C/2506/c2/2x/831bf924-d608-4037-b410-554d5acf5ddc
148,천애협로,지와겸,일,액션/무협,"세상과 호흡하라, 천하를 얻으리! 무림맹주, 아미파 장문인, 군무 제일검, 남궁세가의 안주인을 키워낸 여인, 진무신모 유월향. 매병에 걸린 그녀가, 어느 날 사라져버렸다! 진무신모의 아들 무림맹주는 비밀리에 그녀를 찾아나서고, 그녀의 오랜 숙적 혈마의 부하들도 그녀를 추적한다. 한편 무한 삼진의 가난한 고아들 앞에 갑자기 나타난 정체 기이한 할머니! 할머니는 자신이 고아들의 친할머니라고 주장한다. 고아들은 할머니를 받아들이고 서로 의지하며 살아간다. 그중 맏이 소량의 비범한 재능을 알아본 할머니는 소량에게 무공을 사사한다. 하지만 얼마 지나지 않아 피습의 흔적만 남긴 채 할머니는 사라지고, 소량은 할머니를 찾아 길을 떠난다. 강호에 나선 소량, 진무신모 유월향의 마지막 제자의 이야기 독특한 감성 무협 천애협로 ! 웹툰으로 더욱 웅장하게 돌아왔다!",카카오웹툰,https://kr-a.kakaopagecdn.com/P/C/2324/c2/2x/a16cb6fe-19e3-4d66-929a-4f3756555be9
149,양판소 주인공의 아내로 살아남기,아빈,일,로맨스 판타지,"양판소 주인공의 아내로 빙의했다. 정확히, 주인공의 손에 죽는 악역 조연 겸 사치스런 아내로. 그래도 어렸을 때부터 잘 대해주면 목이 잘리는 상황은 막을 수 있지 않을까? 좋아. 지금부터 내 목표는 평화롭게 이혼하는 것! 그래서 내가 이혼해주면 냅다 노아한테 달려가서 아양 부리시겠다? 으, 응? 말도 안 되는 소리 하지 마. 난 내 아내랑 동생이 노닥거리는 꼴 따위를 보려고 전쟁터에서 그 고생을 한 게 아니니까. 내가 수도에 없는 동안 재미 좋았겠군 그래. 아니 거기서 네 동생 이름이 왜 나와?",카카오웹툰,https://kr-a.kakaopagecdn.com/P/C/2331/c2/2x/8abe8e3b-9229-46f0-8497-6e0775e7589a
150,나를 버려주세요,코타비,일,로맨스 판타지,"희귀병에 걸려 죽은 공녀를 대신해 입양된 아델. 평생을 사랑받기 위해 애썼지만, 여동생이 태어나자마자 버려지고 정략결혼을 하러가던 길에 의문의 적들에게 암살 당해 죽고만다. 그런데 눈을 뜨니, 왜인지 3년전 과거로 돌아왔다! 어차피 여동생이 태어나면 버려질 운명이기에, 이번 생에서는 마음대로 살아보려고 하는데 어쩐지 자꾸만 인생이 꼬여간다. 게다가 정체불명의 검은 기사는 자꾸만 그녀를 찾아오는데...",카카오웹툰,https://kr-a.kakaopagecdn.com/P/C/2388/c2/2x/4d57513c-fd29-42bb-a4c7-5e54d0b0e3b2
151,나 혼자 만렙 귀환자,이지득,일,학원/판타지,"전 세계 1억 2천만 명의 인구가 사라졌다. 최종 퀘스트 완료 보상 귀환 이 시작됩니다 22년 만에 최악의 생존게임을 클리어한 윤상혁. 일일군단, 플레이어 중 최강자라 불리던 그가 돌아왔다. 그 누구도 받지 못한 보상을 통해 모든 것을 가진 채로. 가면의 군주, 귀환 나 혼자 만렙, 나 혼자 풀템, 나 혼자 사이다!",카카오웹툰,https://kr-a.kakaopagecdn.com/P/C/2431/c2/2x/11be9fc1-7fa8-413d-bfaf-28e491ddcaff
152,다행인지 불행인지,은렌,일,로맨스 판타지,"어쩌다 보니 여주인공 등장 전, 남주의 아내 역할을 잠시 맡게 됐다. 이왕 그렇게 된 거 최선을 다해 보려 노력했다. 그랬더니 너 같은 아이가 세드릭의 반려가 되어 다행이구나. 세드릭의 운명적 상대가 나타나면 그녀는 떠나야만 한다. 어떡하지? 이런 나에게 세드릭이 말했다. 내가 사랑에 빠진 상대가 당신일 거라는 생각은, 단 한 번도 해본 적 없었습니까? 여주인공 아델라인이 등장하고 나서도, 똑같이 내게 그렇게 말해줄 거야?",카카오웹툰,https://kr-a.kakaopagecdn.com/P/C/2432/c2/2x/08d07ca3-6afb-4e3a-a9be-f7ad3da1dc33
153,갓 오브 블랙필드,운,일,액션/무협,"Who am I? 프랑스 외인부대의 전설 강찬 ! 아프리카 전장에서 그를 상대한 자들은 공포와 경외를 담아 갓 오브 블랙필드 검은 땅의 신이라 불렀다. 하지만 수니파 추종 세력 SISS의 수뇌인 마살란 사살 작전에 투입된 강찬은 배후에서 날아든 의문의 총알에 전사하게 되고, 점점 감기는 시야 사이로 압도적인 열세에 자신을 믿고 따르던 동료들이 하나 둘 목숨을 잃어가는 것을 마지막으로 무기력하게 눈을 감는다. 그렇게 배신을 당해 죽음을 기다리고 있던 강찬은 의문의 힘에 의해 3년의 시간을 넘어 강찬 으로서 대한민국으로 돌아오게 되지만, 그는 19살의 왕따를 당하는 또 다른 강찬 이었다. 배신자의 복수, 환생에 얽힌 진실을 찾기 위한 강찬의 여정이 시작 된다!",카카오웹툰,https://kr-a.kakaopagecdn.com/P/C/2374/c2/2x/22656db9-5125-426c-9305-f8c221c623ba
154,신데렐라를 곱게 키웠습니다,선셋,일,로맨스 판타지,"유명한 동화가 있다. 아버지와 새어머니가 결혼해 언니들까지 다섯 명의 대가족이 된 마음씨 착한 아가씨. 아버지가 돌아가신 뒤 마음씨 고약한 새어머니와 언니들 밑에서 구박받는 불쌍한 그녀. 바로 그 동화, 신데렐라에 빙의했다. 그런데 하필이면 신데렐라도 아니고, 계모의 몸이란다. 서른일곱 살에 두 번이나 남편과 사별하고 심지어 딸까지 셋 딸린! 세 딸을 건사하느라 정신없는 나에게 자꾸만 접근하는 남자, 다니엘 윌포드. 키스해도 될까요? 사윗감으로는 아무래도 나이가 좀 많은 것 같은데 왜 자꾸 접근하지? ...아, 모르겠다. 일단 신데렐라를 왕자와 결혼시키고 조용히 살아야지. 그런데 이 동화는 정말로 신데렐라 일까...?",카카오웹툰,https://kr-a.kakaopagecdn.com/P/C/2419/c2/2x/374ccb88-c152-4cd4-8004-681a60604f19
155,닳고닳은 뉴비,보늬,일,학원/판타지,서비스 종료까지 앞으로 15년. 오직 나만이 엔딩을 알고 있다. 나는 고인물이다,카카오웹툰,https://kr-a.kakaopagecdn.com/P/C/2446/c2/2x/266c3fa3-9f6d-497e-8639-7526772b1c80
156,풍운전신,한여름,일,액션/무협,희망도 행복도 소멸해 버린 처절한 사십년 간의 전쟁. 패배한 전쟁의 판도를 뒤엎기 위해 두 번의 전생을 거쳐 돌아온 전투의 신이었던 남자의 무림행.,카카오웹툰,https://kr-a.kakaopagecdn.com/P/C/2365/c2/2x/8c3eb239-8043-4af9-a93d-fb734f42b7eb
157,밥만 먹고 레벨업,코개,일,학원/판타지,"전 세계에 단 두 명만 존재하는 희귀병 폭식 결여증에 걸린 주인공. 하루하루 살기 위해 먹는 걸 조절하며 살아가고 있지만 희망이 없어보인다, 의사의 추천으로 시작하게 된 가상현실게임 아테네 에서는 음식을 마음껏 먹고도 살이 찌지 않는데. 살기 위해 게임을 하며 성장하는 식도락 판타지 라이프!",카카오웹툰,https://kr-a.kakaopagecdn.com/P/C/2382/c2/2x/401a9385-015c-40b5-95fc-7126395057e3
158,나 홀로 주문 사용자,민초바,일,학원/판타지,"평범한 샐러리맨으로 살아가는 박도혁, 절체절명의 위기에 빠진 순간 그토록 원하던 각성자가 되었다! 그것도 20대 인생을 바친 게임의 기억과 경험이 내 각성 능력이 되다니!!! 더구나, 10억분의 1인 확률이라는 무려 트리플 각성자! 세계 최고의 정점을 노리는 주문 사용자 박도혁의 기상천외한 활약기가 지금 바로 시작됩니다.",카카오웹툰,https://kr-a.kakaopagecdn.com/P/C/2436/c2/2x/5a3c82ff-f72b-4536-bb4c-43a0eddd2165
159,수라전설 독룡,영광 앤트스튜디오,일,액션/무협,유구한 역사를 자랑하는 약문 들의 잇따른 멸문지화. 시체가 산처럼 쌓이고 피가 바다처럼 흐르는 절망의 지옥에서 마침내 수라 가 눈을 뜬다. 하나도 남김없이 모두 죽일 것이다. 놈들을 전부 죽일 때까지 절대로 끝내지 않아. 약문 백화절곡의 유일한 생존자 진자강. 먼 훗날 강호 무림사에 전설로 기록될 한 사내의 고독한 복수행이 시작된다!,카카오웹툰,https://kr-a.kakaopagecdn.com/P/C/2476/c2/2x/c2a5484b-9cd8-498a-a8f8-e86042ec919e
160,대마법사의 딸,문설아,일,로맨스 판타지,"북쪽 저택, 그리고 진짜 아빠. 이것만을 생각하며 달려나왔다. 대마법사이며, 진짜 아빠란 사람은 내 얼굴도 알아보지 못했다. 너 내 딸인가? 칼을 들이대면서 표정조차 없는 무서운 사람 ! 나는 여기서 잘 지낼 수 있을까? 걱정마세요. 전부 아가씨 거예요. 언제 떠나야 할까 싶어 초조한 내 마음과 다르게 이곳 사람들은 조금 이상하다. 내게 너무 잘해주잖아.",카카오웹툰,https://kr-a.kakaopagecdn.com/P/C/1807/c2/2x/0b8bfe1e-4e30-41dd-bddc-93a849053fa3
161,왕의 딸로 태어났다고 합니다,"프로리, IlIlIIll",일,로맨스 판타지,스물 여섯. 불미스런 사건으로 소박하지만 아름답던 연인 진수와의 사랑을 뒤로하고... 새로운 세계에서 공주님으로 환생한 수희. 하지만 이곳은 남존여비가 팽배한 세상! 공주님 에게도 예외는 없다!! 상희 라는 이름으로 다시 환생한 그녀의 눈에 이 세상은 작은 것 하나하나 마음에 들지 않는다. 세상을 바꾸겠다는 당찬 포부와 함께 그녀의 앙큼한 반란이 시작된다 .,카카오웹툰,https://kr-a.kakaopagecdn.com/P/C/2305/c2/2x/7e3b2b85-dfa1-4205-a2ca-30732f95bb9b
162,정령 농사꾼,구식이,일,판타지 드라마,"농사꾼, 정령을 만나다. 11년 동안 초인이 되기 위해서 노력했지만 결국 일반인으로 끝난 이건우. 모든 걸 뒤로 하고 집으로 돌아왔을 때, 그에게 정령이 찾아왔다. 하와!!!! 본격 농사 힐링 판타지. 농사의 정령 하와와 함께하는 귀농 Life!",카카오웹툰,https://kr-a.kakaopagecdn.com/P/C/2413/c2/2x/7931c998-38e4-49ba-9235-992e74d7925f
163,뜻대로 하세요,권정아,일,로맨스 판타지,"후작 저택의 하녀 디안은 돈에 팔리듯 진행되는 후작 영애의 혼약에 반대하여 한 가지 계책을 꾸며낸다. 영애를 몰래 국경으로 떠나보낸 후 자신을 후작 영애인 것처럼 꾸며 건국 영웅의 후손, 에펜하르트 변경백에게 가짜 신변을 위탁하러 가는데 . 디안은 무사히 백작을 속여 넘길 수 있을 것인가! 요정여왕이 살았다는 북쪽호수를 등진 성에서 이른 봄을 맞으며 펼쳐지는 낭만희극.",카카오웹툰,https://kr-a.kakaopagecdn.com/P/C/2319/c2/2x/9ee47afe-637e-48d0-b174-9d6f1d87c933
164,마성의 신입사원,주연,일,로맨스,"평범한 사원 남지은. 평소 짝사랑하던 다정남 강팀장에게 취중 고백을 날리는데. 내가 고백한 상대가 출중한 외모와는 정반대 성격으로 기피대상 1호인 우리 회사의 대표, 독거마성 마성준이라였다?!",카카오웹툰,https://kr-a.kakaopagecdn.com/P/C/2407/c2/2x/386e5c53-b3de-475e-9924-9f561dbf0f25
165,리벤지 웨딩,사룡,일,로맨스 판타지,"외모, 돈, 신분까지 완벽한 여자 메르케디아 샤샤. 기절했다 정신을 차리고 보니 위치는 바다 한가운데 커다란 배 위, 입은 옷은 웨딩 드레스. 내가 제국 최고의 전쟁 영웅과 결혼을?! 전대미문의 납치 결혼을 당한건 둘째, 무인도에서 단둘이 살게 생겼는데 . 1차 목표는 무인도 탈출! 최종 목표는 복수와 이혼!",카카오웹툰,https://kr-a.kakaopagecdn.com/P/C/2372/c2/2x/69776655-1de0-40ff-8dc9-2f4f3468e19b
166,요리사가 축복을 숨김,나늄,일,판타지 드라마,"비록 지금은 대학병원 비정규직 조리사지만, 정동의 꿈은 요리사. 요리사의 꿈 하나로, 힘들지만 보람찬 하루를 보내고 있는데... 두둥!! 나는 너의 주신, 케레스이니라 이 귀염뽀짝하신 ? 분의 여신이라고??? 어느 날, 신의 목소리가 들려왔고, 그녀의 신관이 된 이후 모든 것이 달라졌다!! 정성스럽게 만든 요리에 귀여운 주문을 외우면, 요리에 축복이 깃들게 해라! 모든 사람들에게 축복 가득한 요리를!! 대학병원 비정규직 조리사로 시작해 미슐랭가이드 레스토랑을 꿈꾸는 정정동의 정성 가득, 케레스의 축복 가득한 요리, 함께 하실 거죠?",카카오웹툰,https://kr-a.kakaopagecdn.com/P/C/2398/c2/2x/23bcbc38-1543-4dc9-8bf8-d1442b881894
167,천재 의사 이무진,견지,일,판타지 드라마,"전교 꼴등이었던 문제아 이무진 이 우연히 만나게 된 1960년대에 활동했던 의문의 천재 유령 의사 아클레 의 도움으로 의학에 관심을 갖고 식물인간으로 누워있는 엄마를 깨우기 위해 천재 의사로 거듭나게 된다, 그러던 중 아클레의 비밀이 서서히 밝혀지기 시작하는데...",카카오웹툰,https://kr-a.kakaopagecdn.com/P/C/2460/c2/2x/a8b9ea98-9b28-46e4-b823-98584d4c7606
168,무협지 악녀인데 내가 제일 쎄!,가비남,일,로맨스 판타지,"하필이면 주인공도 아니고, 소설 속 제일가는 악녀라니 월세 탈출을 위해 읽기 시작한 무협 소설 남궁세가 소가주 그중 최고 악녀 당해원으로 빙의하게 된다. 흠모하던 남자를 얻기 위해 남자의 정인에게 독약을 먹이고, 무림의 고수들을 이간질하고, 마교의 앞잡이가 되어 강호를 혼란에 빠뜨리는 세계관 최고 악녀, 당해원. 소설처럼 이렇게 당할 순 없어 !! 우연히 삼킨 만년삼으로 인해 세계관 최강자가 되어버린 무협 소설 속 최고 악녀 당해원 의 갱생기!",카카오웹툰,https://kr-a.kakaopagecdn.com/P/C/2455/c2/2x/596b3d3f-d829-46b9-b45a-673f67221fa7
169,나 홀로 버그로 꿀빠는 플레이어,청초,일,학원/판타지,"과도한 업무와 밤샘 게임으로 돌연사?! 눈을 뜬 나를 반긴 것은 게임 파라디소 의 세계관 속이었다. 그것도 초고도 비만의 몸뚱이와 몰락하기 일보직전의 완벽한 듣보잡 엑스트라 영주, 자레드의 몸으로 환생했다! 망할! 소설이나 영화 속 주인공들은 존잘남으로 태어나서 호의호식하며 잘 살던데! 그러나, 반드시 정점을 차지하겠어! 성공하고 성장 할 수 있다면 버그든 꼼수든 무엇이든 OK! 자레드의 혹독한 다이어트와 버그로 꿀 빠는 치열한 현생도전기가 시작된다! 원작소설 나 홀로 버그로 꿀빠는 플레이어",카카오웹툰,https://kr-a.kakaopagecdn.com/P/C/1929/c2/2x/b2bab23a-4b88-442d-92b3-f49a68806d53
170,그 결혼 제가 할게요,갈치구이,일,로맨스 판타지,데드 엔딩을 피하기 위해 언니 레일란 대신 불면증 황제에게 가게 된 릴리안 맥켈리온 상대방의 신체에 입술이 닿으면 잠들게 하는 능력을 이용해 마녀의 저주에 의해 단 하루도 잠들지 못하는 황제의 밤을 책임져야만 한다. 릴리안은 황제 카엘 루 칼도르프 로부터 무사히 살아남을 수 있을까?,카카오웹툰,https://kr-a.kakaopagecdn.com/P/C/2393/c2/2x/85adfc62-4c60-4422-9c68-6b94f9cbf362
171,무당기협,기파란,일,액션/무협,무림 사파의 수장인 혁련무강은 죽기 직전 불로초를 삼킨 후 눈을 떠보니 무당파 도동의 몸에 빙의되었다. 예전에 본인이 붕괴 직전까지 몰고 갔던 무당파에서 진무 라는 이름의 도사로 다시 살게 된 그는 무당의 양의신공 을 전수받기 위해 애쓰다 보니 뜻하지 않게 무당이 부흥하는데...!,카카오웹툰,https://kr-a.kakaopagecdn.com/P/C/2499/c2/2x/5eaed52f-463e-4414-a38c-e2c90dd1567f
172,꽃은 춤추고 바람은 노래한다,상행,일,로맨스 판타지,"누구나 선망하는 화려한 삶을 살았지만 ㅤㅈㅓㄼ은 나이에 병으로 죽은 에르셀라. 그녀는 죽기 전 아들에게 제대로 된 어미가 되지 못한 것을 후회했다. 그런데 어쩐 일인지 3년 전으로 돌아왔다. 2회 차 인생을 살게 된 에르셀라. 이번에는 다정한 엄마가 되리라 다짐한다. 하지만 너무 늦은 것일까. 이제 와서 이러시는 것은 불쾌감만 들게 할 뿐입니다. 아들은 그녀를 밀어내기만 하고, 회귀 전 괜찮은 줄로만 알았던 남편과의 관계도 잘못되어 있었음을 깨닫게 되는데",카카오웹툰,https://kr-a.kakaopagecdn.com/P/C/2439/c2/2x/aa50f7cd-a263-4b40-a235-ed1696073e12
173,남궁세가 소공자,기성욱,일,액션/무협,"이세계를 평정하고 무림으로 돌아온 남궁서휘! 가족과의 불화로 집을 떠나 달이 두 개 떠 있는 이세계로 떨어지게 된 남궁서휘는 아스밀리온 을 만나 그와 절친한 벗이 된다. 절대자의 힘을 얻고 그를 도와 세계를 평정하였으나, 함정에 빠져 벗을 잃게 되고 고향인 중원으로 돌아온다 시간의 흐름 속에 홀로 남겨지는 바람에 어린 소년의 모습을 하고있는 남궁서휘를 그의 이복형인 남궁서윤은 따뜻하게 맞이해준다. 그런 착한 형을 위하여, 남궁서휘는 남궁서윤을 남궁세가의 가주로 만들기로 결심한다. 순진한 어린아이의 가면을 썼지만, 그 안에 절대자의 힘과 잔혹함을 숨기고 있는 남궁서휘. 폭풍 속의 중원 무림, 남궁서휘의 결심에 따라 세가와 무림의 운명이 결정되는데",카카오웹툰,https://kr-a.kakaopagecdn.com/P/C/1947/c2/2x/889fb27a-3785-4e7b-ab30-fe412ffca6ad
