,title,author,day,genre,story,platform,Thumbnail
37,악녀는 마리오네트,망글이,화,로맨스 판타지,"아름다움은 진짜 권력이 될 수 없다. 제국에서 가장 아름답다 칭송받지만, 사치와 패악밖에 모르는 황녀 카예나 힐. 그녀는 폭군 남동생이 제위를 얻기 위한 장기말로 이용 당하다 미치광이 남편에게 살해당해 악역다운 최후를 맞을 예정이었다. 내가 그 카예나 황녀가 되기 전까지는. 너를 황제로 만들어줄게. 누님이 저를 말입니까? 대신 나에게 자유를 줘. 독가시를 품은 장미, 죽음을 부르는 아름다움 이번 생은 나로서 살아가고 싶다.",카카오웹툰,https://kr-a.kakaopagecdn.com/P/C/2464/c2/2x/c41c9a24-1f28-4dd6-ac59-2bcfda2492e6
38,남주의 엄마가 되어버렸다,걈미,화,로맨스 판타지,"남주 덕질 3년차. 아들 바보, 폭군 하데스 루버몬트 공작에게 딱 걸리고 말았다. 줄기차게 따라다녀, 비싼 선물 공세에, 이제는 목숨 아까운 줄도 모르고 혈혈단신으로 북부까지 올라오다니 . 미안합니다. 할 말이 없네요. 그래, 내가 졌어. 도저히 모른 척할 수가 없는 정성이야. 역시 제가 좀 그렇죠? 제가 생각하기에도 이만한 정성이 없어요. 좋다고 따라다니는 여자들은 꽤 됐지만, 영애만큼 집요한 사람은 본 적이 없어. 놀라울 정도야. 하지, 결혼. 빠른 시일 내에. 하아 . . 예, 받아들이겠습니다. . 아니, 예?! 뭐라고요? 시방 이것이 뭔 소리라니? 잘못 들은 게 분명하겠지? 그러나 공작은, 멍해진 내 얼굴을 바라보며 피식 웃더니 제대로 확인 사살을 해줬다. 해주겠다고, 결혼. 이럴 수가. 남주 아빠의 자의식 과잉이 상당하다. 책빙의 일까? 착각계 내가 따라다닌 건 너 말고 네 아들! 성덕이 된 여주X자의식 과잉만 빼면 멋진 아버님 아들 귀여워!",카카오웹툰,https://kr-a.kakaopagecdn.com/P/C/2445/c2/2x/7683f619-b639-42b7-b901-c87b64af2582
39,악녀는 두 번 산다,피치베리,화,로맨스 판타지,"모략의 천재, 황제를 만들다! 오빠가 잘되어야 너도 잘되는 거야. 온갖 악행을 저질러 오빠를 황제로 만들었다. 하지만 아르티제아의 헌신은 배신으로 돌아왔다. 죽음의 문턱에서 그녀에게 구원의 손을 내민 것은, 정의로운 숙적 세드릭 대공뿐이었다. 계책을 내라. . 이 상황을 뒤집을 수 있는 인물을 나는 그대 외에는 떠올리지 못하겠어. 로산 후작. . 나에게는 그대의 힘이 필요하다. 이미 기울어진 세력 판도를 뒤집고 도탄에 빠진 제국을 구할 계책은 없다. 그러나 방법은 있다. 모든 것이 잘못되기 이전으로 시간을 돌리는 것. 피의 눈물과 함께 그녀는 자신의 몸을 바쳐 고대마법으로 시간을 돌린다. 이번에는, 실패하지 않으리라. 죽지 않고 18세로 회귀한 아르티제아는 세드릭 대공을 위한 악녀가 될 것을 결심한다. 저에게 청혼해 주십시오. 당신을 황제로 만들어 드리겠습니다. 악마에게 무릎을 꿇은 대가로, 당신은 당신 대신 손을 더럽힐 악마를 얻을 것입니다.",카카오웹툰,https://kr-a.kakaopagecdn.com/P/C/2394/c2/2x/2aa9fc09-b4ae-4ee1-a6ec-8007a5a495fa
40,아이리스 - 스마트폰을 든 레이디,윤혜,화,로맨스 판타지,"남편은 사촌동생과 바람이 나고 가문은 송두리째 시가에 빼앗겼다. 절망에 빠져 생을 마감한 순간, 전생의 기억이 떠올랐다. 서울의 취업준비생 백연화의 삶이. 과거로 돌아온 그녀는 결심했다. 두 번 다시 그들에게 버려지지 않겠다. 이제 내가 그들을 버리리라! 그런데 . 이안은 아이리스의 눈을 지그시 응시했다. 일전에 제가 했던 말을 기억하십니까? 의뢰비는 다른 것으로 받으시겠다는 말씀 말인가요? 예. 지금 받고 싶군요. 아이리스는 가진 게 없는 사람이었다. 다른 귀족 자제처럼 든든한 부모가 있는 것도 아니고, 돈이 많지도 않았다. 그런 자신에게 무얼 받겠다는 말일까. 아이리스가 깜빡였다. 그가 빙그레 웃으며 말했다. 나랑 연애하자. 선황의 장자, 제국 최고의 미남, 완벽한 남편감으로 손꼽히는 발렌시아가 공작이 왜 내게?! 복수를 위한 동아줄이 날 잡아달라고 살랑거린다.",카카오웹툰,https://kr-a.kakaopagecdn.com/P/C/2321/c2/2x/004dfc0c-e86d-49af-b216-9e4b10c546cc
41,더 이상 사랑하지 않는다,수수,화,로맨스 판타지,"하녀의 딸로 태어나 부모의 사랑을 받지 못한 니베이아에게 비록 태중약혼의 상대이지만 발레르는 유일한 사랑이었다. 하지만 10년 동안 약혼자에게 냉대받으며 파혼을 종용당했던 니베이아는 그에게 지쳐 그를 떠나기로 결심하고, 전략에 걸맞은 결혼 상대가 필요했던 인접국 빈프리트의 황제에게 청혼한다. 사랑하지 않을 것 을 조건으로 걸고",카카오웹툰,https://kr-a.kakaopagecdn.com/P/C/2451/c2/2x/31309f1c-4196-4910-8c5d-e5a27d227516
42,은빛마계왕,팀 다람즈 COPIN,화,판타지 드라마,"수능시험을 망치고 한강에서 투신하려던 하유안. 그에게 마계 4장로 중 하나인 아레스 아스타로트가 나타나 제안을 한다. 영혼이 사라진 마왕의 몸에 들어가 그의 대역을 하라는 것. 수능 전날로 보내주겠다는 조건에 하유안은 그의 제안을 받아들이기로 한다. 역대 최강이자, 두려움의 대명사였던 마왕 류칼레시안 세르피오. 평범한 고등학생인 하유안이 과연 그의 대역을 잘해 나갈 수 있을까?",카카오웹툰,https://kr-a.kakaopagecdn.com/P/C/2418/c2/2x/935d111e-11f2-4edf-a15e-3cbfb0e7a37e
43,록사나 : 여주인공의 오빠를 지키는 방법,백지연,화,로맨스 판타지,"어쩌다 보니 19금 역하렘 소설에 빙의했다. 문제는 내가 악역 서브남의 누나가 되었다는 건데... 망할 아버지가 기어이 여자 주인공의 오빠를 납치해 왔다. 이제 여주인공의 가문에 복수 당해 몰락할 일만 남은 건가. 아아, 데드 플래그 피하기 진짜 힘들다. 이번 장난감에는 저도 흥미가 있어요. 오빠, 이렇게 된 이상 내가 지켜줄게요. 그러니까 이 은혜는 나중에 꼭 갚아요, 알았죠?",카카오웹툰,https://kr-a.kakaopagecdn.com/P/C/2466/c2/2x/3fedd6d2-64aa-40f3-ad8a-c1208c9bf593
44,못난이 공녀가 되었습니다,강세아,화,로맨스 판타지,"하필이면 못난이 공녀에 빙의했다. 자신을 경멸하는 가족들의 관심을 받기 위해 여기저기 패악을 부려, 그 결과 사람들의 무시와 비웃음을 한 몸에 받으며 못난이 공녀 로 불리던 실비아 아틀란테로. 죽기 위해 스스로 독을 마시고 생을 마감한 실비아의 몸에 내가 들어왔지만, 나는 그녀처럼 살고 싶지 않았다. 돈도 많고 몸도 건강한데, 다른 사람 신경 쓰며 살 필요가 뭐가 있어? 내 인생, 내 맘대로 살다 가면 그만이지! 그렇게 내 살 길 묵묵히 찾아갔을 뿐인데... 다들 갑자기 왜 이러는 거야? 실비아의 기억과는 너무 다르잖아? 난 조용히 살고 싶은데?! 그래도 넌 내 동생이고, 아틀란테의 일원이야.",카카오웹툰,https://kr-a.kakaopagecdn.com/P/C/2448/c2/2x/0a098fb8-5325-4a99-96f3-8cee1491e838
45,빈껍데기 공작부인,한진서,화,로맨스 판타지,"약혼자의 숨겨진 연인이 나의 사촌오빠라는 진실을 알던 날, 나는 비참하게 죽었다. 그리고, 기적처럼 찾아온 두 번째 스무 살 아침. 나는 더 이상 사랑을 믿지 않기로 했다. 눈앞에 보이지 않는 감정보단 명확한 계약관계만을 원하게 되었다. 아젠타인 공작님, 저와 결혼해 주시겠어요? 사랑 없는 계약 결혼에 불과한데, 아젠타인, 이 남자를 지켜주고 싶어졌다. 빈껍데기 공작부인",카카오웹툰,https://kr-a.kakaopagecdn.com/P/C/2351/c2/2x/fccd8315-701b-422b-aa14-ed67922cc328
46,8서클 마법사의 환생,스튜디오 이너스,화,학원/판타지,대륙을 통일한 구국의 영웅이자 8서클의 대마법사 헨리 모리스! 친우였던 선대 황제가 죽은 뒤 아들인 현 황제가 귀족의 꼭두각시가 되면서 반역죄로 몰려 어이없이 처형을 당하게 된다. 그리고 모든 것의 끝이라는 죽음을 맞이한 그 순간! 헨리 라는 같은 이름을 가진 약해 빠진 어느 검사의 몸으로 되살아난다. 이번 생에 내가 할일은 정해진 것 같군. 8서클 대마법사이자 소드마스터가 되는 거야! 지옥에서 돌아온 헨리의 화려하고 잔혹한 복수극이 지금 시작된다!!!,카카오웹툰,https://kr-a.kakaopagecdn.com/P/C/2389/c2/2x/251b83da-9284-47e4-89cd-529905b5f21a
47,로열 셰프 영애님,파야,화,로맨스 판타지,작은 기사 식당의 요리사였던 나는 황제도 두려워하는 권력가의 천덕꾸러기 막내딸이 되었다. 여비를 모아서 도망치려고 했는데 . 이상하다. 네게 미안하다고 하면 염치가 없는 건가. 그야 내가 네 오빠니까. 할애비와 산책해 주지 않는 거냐. 다들 갑자기 왜 잘해 주는 거지? 너를 보는 놈들의 눈알을 죄 뽑아 버리고 싶은 건 왜일까요. 도망치려는 나와 붙잡는 사람들. 요리만 했을 뿐인데 왜 이러는 거람 . 그녀가 예뻐 죽는 가족들 도망치고 싶은 그녀 여주 한정 머슴들의 등장,카카오웹툰,https://kr-a.kakaopagecdn.com/P/C/2401/c2/2x/39fe22b5-fd37-4c92-8f66-9dd96fc1ecd1
48,닥터 최태수,김한석,수,판타지 드라마,"대학병원의 가장 말단 의사, 걸어다니는 깡통 인턴. 하루하루, 인턴으로서의 고된 나날을 보내던 최태수는 우연히 세계최정상의 흉부외과의사인 리처드 카프레네 의 임종을 지키게 된다. 이때, 놀랍게도 카프레네의 모든 의학지식이 고스란히 최태수에게 전이되는데 !! 따뜻한 심장을 지닌 천재흉부외과의, 최태수가 일궈내는 기적의 메디컬 드라마!",카카오웹툰,https://kr-a.kakaopagecdn.com/P/C/2310/c2/2x/bcc46715-0326-4e41-9eda-fdcc32ffc8f1
49,태양의 주인,KONN,수,로맨스,바얀은 담담히 말했다. 폐하를 갖고 싶어요. .뭘 갖고 싶다고? 단은 웃는 모습 그대로 굳었다. 치유력을 가진 시요족. 치유력을 갖지 못하여 마을에서 천대 받으며 살아가던 바얀과 신의 형벌을 받아 끊임없이 지독한 갈증에 시달리는 단. 그들의 운명적 사랑 이야기,카카오웹툰,https://kr-a.kakaopagecdn.com/P/C/2519/c2/2x/93309cd4-c68e-4ce3-85a3-e50d0301608a
50,당신의 이해를 돕기 위하여,라뇽 각색,수,로맨스 판타지,"왕녀인 바이올렛은 왕실의 막대한 빚을 갚아준 윈터 블루밍과 결혼한다. 결혼식에서 처음 본 윈터에게 반한 바이올렛. 운이 좋다고 생각한 것도 잠시, 오빠인 에쉬가 왕실 해체를 선언하자 사기꾼이라는 오명을 뒤집어쓴다. 작위도 얻지 못하고 전 재산만 날린 윈터는 결혼 첫날밤에도 집으로 돌아오지 않는다. 지옥 같은 결혼생활을 한 지도 3년. 저 바쁜 남자가 내 장례식엔 와줄까? 돈을 버는 데만 열중하고, 자신에겐 냉담하기만 한 윈터로 인해 바이올렛은 점차 시들어 간다. 모든 것을 끝내리라 마음먹은 그때, 윈터와 몸이 뒤바뀌는데 . 내가 정말 미쳐버렸나 봐, 이건 망상일까?",카카오웹툰,https://kr-a.kakaopagecdn.com/P/C/2480/c2/2x/b7ca28de-d97e-4a03-9ca8-d3add31f31f8
51,성좌들이 나만 좋아해,슈퍼코믹스스튜디오,수,학원/판타지,미스테리한 탑이 생겨나면서 세상이 멸망했다. 탑은 오로지 자신의 주위에만 빛을 내려 인간들의 유일한 터전이 되어 주었다. 이에 인간들은 탑의 정상에 모든 비밀이 있을거란 믿음으로 탑을 오르기 시작했다. 그 과정에서 인간을 초월한 성과를 이룬 자들은 탑의 정상에 별자리로 새겨지며 성좌 라는 칭호를 얻게 되었는데 회귀를 반복하던 백호민은 비밀스런 성좌들의 도움을 받으며 탑을 오르게 된다.,카카오웹툰,https://kr-a.kakaopagecdn.com/P/C/2518/c2/2x/9abea65e-8c04-4db5-8adf-e90116602d38
52,낭선기환담,김순태,수,액션/무협,"호랑이로 환생하여, 영물이 되어 살아가던 산의 주인 산군. 평화롭게 살아가던 산군의 앞에 한 소녀가 찾아오게 된다. 대뜸 지아비로 모시겠다고 하는 소녀. 귀찮은 산군은 그녀를 내쫓으려고 하지만, 그녀는 돌아갈 곳이 없다. 결국 소녀를 거두기로 결심한 산군. 그런 그에게 수많은 위협이 닥쳐오게 되는데 .",카카오웹툰,https://kr-a.kakaopagecdn.com/P/C/2496/c2/2x/fd49eb65-9805-44f9-87c3-2c4dcdd16b60
53,악녀의 남주님,R수없음,수,로맨스 판타지,"유니페 마그놀리아. 여주인공 라엘 카니아의 친구이자 악녀. 소설 속 유니페는 남주 이시드를 사랑하여 그의 사랑을 받는 라엘을 질투해 괴롭히다가 남조 카시안에게 죽임을 당하는 운명이다 그런데, 내가 왜 유니페가 된 거야!! 하지만 다시 생각해보자. 유니페가 죽임을 당하는 건 1년 후니까 일단 이시드를 만나다가 이시드와 라엘이 만나면 빠져나오면 되니까, 일단 만나보는 거야! 그런데, 해도해도 너무 다정하고 따듯한 이 남자와 과연 헤어질 수 있을까? 악녀의 남주님 지금부터 시작합니다!",카카오웹툰,https://kr-a.kakaopagecdn.com/P/C/2515/c2/2x/7b5e3cbe-fbc0-4cf6-a24a-5f71f2f71ee1
54,이계 검왕 생존기,권순규,수,학원/판타지,"귀하는 적합자로 선택받았습니다 귀하의 재능으로 셀하 라트나에서 생존할 확률은 5 미만입니다 자살하시겠습니까? Y N x 까. 5 미만의 생존 확률. 22년의 시간. 셀 수도 없는 마견과의 사투. 이 지옥에서, 나는 홀로 살아남았다. 5라는 레벨 뒤에 감춰진, 무지막지한 히든 스탯들과 함께! 대검 하나로 이계를 썰어버리는, 사상 최강의 레벨5 검사 류한빈의 극한 사이다 생존기!",카카오웹툰,https://kr-a.kakaopagecdn.com/P/C/2363/c2/2x/b59adf3f-6d62-4830-a31f-693b80909c78
55,해골병사는 던전을 지키지 못했다,앤트스튜디오,수,학원/판타지,"나는 해골 병사 . 주인인 서큐버스님을 지키지 못하고 그저 하찮게 부서져버린 일개 몬스터. 그렇게 죽음을 맞이하는 줄 알았다. 그러나 정신을 차려 보니, 20년 전 사령술사에 의해 눈을 뜬 그 날로 돌아왔다. 남들에겐 보이지 않는 상태창과 함께, 죽어도 죽어도 몇 번이고 되살아나나게 되었다.",카카오웹툰,https://kr-a.kakaopagecdn.com/P/C/2358/c2/2x/9c3ae4fb-1e6b-4dab-a720-ca0eacef725b
56,"계모인데, 딸이 너무 귀여워",모구랭,수,로맨스 판타지,"다이어트도, 업무도 열심히 하면서 평범하게 살아가던 나 이백합 . 과로사로 죽은 줄 알았는데 자신보다 예쁜 의붓딸을 질투한 나머지 딸을 독살하고, 결국 남편에게 처형되는 동화에 빙의했다?! 이대로 처형당할 수 없으니 귀엽고 사랑스러운 딸, 블랑슈와의 관계를 개선해 사망 플래그를 없애야 한다! 뭘 해도 귀여운 블랑슈에게 사랑을 퍼붓는 일은 즐거운데 우습군요. 부인이 언제부터 그렇게 블랑슈를 아꼈다고? 망할 남편 놈이 날 자꾸 방해한다! 저도 블랑슈의 부모입니다. 절 의심한 걸 사과하세요. 사과하지 않으면? 오늘 밤 전하의 침소로 찾아가겠어요. . 특별히 아주 섹시한 속옷도 준비했답니다. 나는 싱긋 웃으며 치명타를 날렸다. 지금 당장 보여드릴까요? 순식간에 일그러지는 남편의 얼굴이 아주 볼만했으니, 나는 계획한 대로 귀여운 딸 블랑슈를 덕질하며 행복한 두 번째 삶을 살 수 있을까?! 딸덕질 가족물 로맨스코미디",카카오웹툰,https://kr-a.kakaopagecdn.com/P/C/2487/c2/2x/5cc7f0bb-fe11-40f2-8e98-f2b1cf7344d4
57,장르를 바꿔보도록 하겠습니다,가린,수,로맨스 판타지,"좋아했던 장르 소설 속에 빙의했다. 하필이면 어린 주인공을 학대하는 악역 이모로. 복수극의 주인공으로 자라날 조카가 안쓰러워 원작대로, 삼촌이 나타나 조카를 데려갈 때까지만이라도 살뜰히 보살피려 노력했다. 그랬더니... 어, 엄마! 졸지에 애엄마가 되어버렸다?! 사정이 어떻게 되신 건지는 모르겠습니다만, 모자지간을 어떻게 찢어두겠습니까? 숙녀분도 함께 빈터발트로 가시지요. 야, 김루카! 이 오해는 어떻게 풀어줄 건데!",카카오웹툰,https://kr-a.kakaopagecdn.com/P/C/2494/c2/2x/edd9ecef-f89b-4369-9f7c-92784e27fc49
58,북검전기,해민,수,액션/무협,"무협소설의 최강자 우각의 동명 소설 북검전기 가 만화로 새롭게 태어나다! 세상을 혼란에 빠뜨린 집단 밀야에 맞서기 위해 중원의 고수들이 모여 만들어낸 북천문! 북천문의 강력한 투쟁으로 밀야는 서서히 그 모습을 감추었고, 북천문은 중원을 평화를 대표하는 집단으로서 강력한 위용을 과시하게 되었다. 그러나 평화가 길어지자 중원의 고수들 사이에서는 북천문에 대한 은밀한 시기가 생겨났고, 결국 북천문의 4대 문주인 진관호는 배신자들에게 둘러싸인 채 스스로 목숨을 끊음으로서 파국의 끝을 맞이하게 된다. 모두가 떠난 북천문에 홀로 남은 진관호의 아들 진무원 13세 은 무공이라고는 손톱만큼도 알지 못 하는 어린 소년. 그러나 남몰래 아버지가 전수한 고어 를 통해 북천문의 벽에 새겨진 무공을 익히기 시작한다. 그러던 어느날, 진무원의 앞에 정체를 알 수 없는 한 소녀가 나타나게 되는데 !!",카카오웹툰,https://kr-a.kakaopagecdn.com/P/C/2362/c2/2x/55efa879-aae7-4b44-aa17-67d9b929674b
59,쉬고 싶은 레이디,솜땀,수,로맨스 판타지,"왕, 마법사, 악사, 검사, 부호, 거지, 성녀, 마녀... 수없이 전생을 거듭하며 그녀는 천년을 살았다. 때론 세상에서 가장 존귀한 자로, 때론 가장 비천한 자로. 그중에서도 53번째 삶은 손꼽힐 정도로 처참하고 괴로웠다. 그리고 다시 시작된 54번째 삶, 그녀는 지쳤다. 다 귀찮아. 이젠 제발 좀 쉬고 싶어. 이번만큼은 반드시 게으름뱅이 나무늘보의 삶을 살고자 결심했는데... 왜 자꾸 귀찮게 하니... 언니 좀 쉬자.",카카오웹툰,https://kr-a.kakaopagecdn.com/P/C/2482/c2/2x/cd82a359-de12-4657-ae55-8c9f426f1d51
60,마검왕,소구미,수,액션/무협,평범한 고등학생 진욱의 무림과 현실을 넘나드는 액션 판타지,카카오웹툰,https://kr-a.kakaopagecdn.com/P/C/2304/c2/2x/5c928df5-2e3c-4575-9cf3-7d9d8a3fffd8
61,탐식의 재림,김종일,수,학원/판타지,"굴라 Gula 의 아들이 돌아왔다. 도박에 미쳐 살았다. 가족과 등을 지고, 여자 친구도 배신했다. 하루하루 허송세월로 보냈다. 쓰레기 같은 인생이었다. 현실이 말했다. 넌 뭘 해도 안 되는 놈이라고. 비참한 현실을 바꾸려 비현실을 선택했다. 하지만 거기서도 마찬가지. 고생 끝에 낙이 오나 싶었지만, 커다란 세력 앞에 허무하게 무릎 꿇었다. 공든 탑이 물거품이 되어버렸다. 한 번쯤은 진정한 자신을 알고 싶었다. 가까이 오너라, 나의 아이여. 이번에는 참지 않았다.",카카오웹툰,https://kr-a.kakaopagecdn.com/P/C/2354/c2/2x/24a50789-df20-49cb-8a52-087e1c18e646
62,목표는 금수저로 무병장수하기입니다,"요슈아, 남사랑",수,로맨스 판타지,"기껏 금수저로 태어났는데, 비참하게 살해당한다고? 철저하게 살아남아서 무병장수해 주겠어! 좋아하는 소설 남주의 여동생으로 환생했는데, 열일곱 살에 계모에게 독살당할 운명이다. 오빠는 여주와 모험 중이니, 나 혼자 어떻게든 살아남아야 하는데...! 나는 이 세계에 대해서 알고 있어. 책 속의 수많은 인물 중에서 나에게 도움이 되는 사람들이 있을거야! 비참하게 죽을 운명을 피해 금수저로 잘 먹고 잘살기를 꾀하는 나, 아드리아나에게 제국의 황자, 수상한 상단 주인, 더 수상한 마족이 접근하기 시작한다! 그래. 이대로 얌전히 죽어줄 순 없어! 난 살아남을 거야! 내 목표는 금수저로 무병장수하기니까!!",카카오웹툰,https://kr-a.kakaopagecdn.com/P/C/2403/c2/2x/0611484b-e5e9-44d1-877e-a8f51e3ead86
63,영주님의 코인이 줄지 않음?!,홍대의,수,학원/판타지,"암살자에게 비참한 죽음을 당하고, 과거로 회귀한 에른. 그런데 그의 눈에 차원거래서가 깃들어 있었다! 거래가 완료되었습니다. 보유 포인트 ?????P 모든 기억을 가지고 회귀한 에른, 중고로운 차원나라... 아니 평화로운 차원나라에 폭풍이 불기 시작했다!!",카카오웹툰,https://kr-a.kakaopagecdn.com/P/C/2513/c2/2x/374eafc9-36a8-4be9-ad94-23c0af3b8c96
64,나 혼자 천재 DNA,지운성,수,판타지 드라마,"당신은 인류 역사상 최초로 생명의 플레이어가 되었습니다. 내 몸에 스며든 생명세포 로잘린. 로잘린과 함께라면, 아무도 모르는 생명의 비밀을 전부 파헤칠 수 있다. 류 박사님! 박사님이 만든 세포가 배지에서 자랐어요! 이거 배아줄기세포 맞죠?! 세상의 모든 불치병들, 백혈병, 치매, 조현병, 폐암, 췌장암 저걸 다 정복할 수 있을까? 물론입니다. 모든 질병을 정복해 가는 류영준 박사와 로잘린의 이야기. 나 혼자 천재 DNA",카카오웹툰,https://kr-a.kakaopagecdn.com/P/C/2412/c2/2x/a02e2891-ece3-477c-99e0-e3146a8dae4c
65,정령왕의 딸,구름빛 COPIN,수,학원/판타지,평범한 대한민국의 여고생인 해인은 어느 날 수영장에 놀러 갔다가 이상한 소용돌이에 휘말려 정신을 잃게 된다. 깨어나 보니 이 세계의 바닷속. 그녀는 자신을 아버지라고 주장하는 정령왕 엘라임과 마주하는데 물의 정령왕인 아버지와 하프 엘프 어머니 사이에서 태어났다는 사실을 알게 된 해인. 그녀는 갑작스럽게 온 이세계에서 살아남을 수 있을까?,카카오웹툰,https://kr-a.kakaopagecdn.com/P/C/2396/c2/2x/9a667bba-0cba-49c4-a570-fdff8743a99b
66,프리실라의 결혼 의뢰,메로나,수,로맨스 판타지,"프리실라 모티아는 용병단에서 마법사로 일하고 있지만, 한때 영지를 가진 백작가의 외동딸이었다. 아버지가 돌아가시고, 계모가 사치품으로 재산을 모두 탕진해 10살 연상의 이혼남에게 팔아먹기 전까진 . 용병일을 하다 닥친 사고로 프리실라는 죽기 직전 드래곤 하트 를 손에 넣는다. 잃어버린 15년을 되찾을 기회! 그녀는 큰 모험을 시도하기로 결심한다. 돌아왔구나! 하지만, 돌아온 프리실라를 기다리고 있는 건 엄청난 빚과 그녀와의 결혼으로 영지와 작위를 빼앗을 궁리를 하는 이혼남. 프리실라는 복수를 위해 전장의 검은 사신 키안 루스틴을 찾아간다. 당신에게 의뢰를 하고 싶어요. 무슨 의뢰죠? 암살의뢰인가요? 키안 루스틴! 제 남편이 되어주세요. 과연, 프리실라는 의뢰를 허락받고 영지도 사랑도 쟁취할 수 있을까?",카카오웹툰,https://kr-a.kakaopagecdn.com/P/C/2357/c2/2x/645669ac-9930-4280-8b43-8aadc1b9d2e3
67,이별을 희망합니다,이오,수,로맨스 판타지,"빚쟁이들에게 쫓기다 사고로 죽어 요정의 화원 속으로 빙의했다. 그런데 왜 하필, 악녀에게 빙의한 거야! 희대의 팜므 파탈이자 악명 높은 악녀, 아이네 르 포레그린. 여주에게 악행을 부리며 괴롭히고, 아름다운 남자들을 수집하는 괴상한 취미까지 있다. 하지만 그녀는 결국 자신이 수집한 남주들에게 살해당하는데 . 안 돼, 이렇게 죽을 순 없어! 좋아! 오늘부터 내 목표는 이별 이다. 내 목숨을 위협하는 위험 요소는 단 하나도 남기지 않고 안전하게 이별하는 것! 내가 오늘 공작저를 찾은 이유는 그대와 파혼을 하기 위해서가 아니라. . 파혼을 하지 않겠다는 의사를 전하기 위해서야. 그런데 이 남자 왜 이러지? 여주와 사랑에 빠져야 할 대공이 파혼을 거부한다. 그뿐 아니라 속을 알 수 없는 암살 길드장 제이와, 모성애를 불러 일으키는 울프족 시온도 떨어뜨리려 할수록 더 달라붙는데 . 그녀는 과연 세 명의 남자와 이별하고 목숨을 지켜낼 수 있을까?!",카카오웹툰,https://kr-a.kakaopagecdn.com/P/C/2387/c2/2x/c85e2e1e-aaaa-4616-9fd8-24c7727dc2d9
68,피폐물 주인공의 부인이 되었습니다,네프,수,로맨스 판타지,"살아남고자 소설의 내용을 바꾸려 하는 알렉시아. 그녀를 붙잡아 두고 싶은 테르뷔온. 정체를 알 수 없는 원작의 여주인공, 오필리어. 원작의 이야기는 이제 완전히 다르게 흘러가기 시작했는데",카카오웹툰,https://kr-a.kakaopagecdn.com/P/C/2495/c2/2x/682d63e0-99e2-438f-b6f5-8f2b7444012a
