,title,author,day,genre,story,platform,Thumbnail
69,뇌신전생,ARC,수,액션/무협,무림을 파멸로 몰아넣던 지옥혈마대를 쓰러트린 영웅이었으나 영웅을 원치 않던 칠대세가들의 배신으로 죽음을 당한 주인공 그러나 아홉 번의 삶을 가능하게 하는 구전환생주의 공능으로 백가검문의 애물단지였던 백무군으로 환생하게 된다. 전생으로부터 흘러간 시간은 고작 30년! 그렇다면 아직 그 원수 놈들이 살아 있으렸다? 복수 그리고 아직 못다한 인연을 마무리 짓기 위해 그의 마지막 무림행이 시작된다!,카카오웹툰,https://kr-a.kakaopagecdn.com/P/C/2438/c2/2x/a2664d77-a9fc-449b-8342-259672d3641a
70,봄의 에스프레소,권도희,수,로맨스,"9년이나 운영하던 카페 봄 을 닫고 구직에 나선 봄솔. 잘생기고 실력 좋지만 까칠한 세계적인 바리스타 제이크 케이 아래에서 일하게 된다. 그런데 어딘가 그의 모습이 낯익은데? 봄솔의 첫 회사생활. 과연 순탄하게 지낼 수 있을까? . . . 이제 기억할 때도 됐지 않아요? 카페 봄, 단골, 고등학생.",카카오웹툰,https://kr-a.kakaopagecdn.com/P/C/2459/c2/2x/c9c4fd43-fbc4-464c-9ecd-22aec6d7730f
71,폭군 오빠가 셋이래요,"km, 깨구리",수,로맨스 판타지,"이름조차 없어 수요일로 불리는 요일 노예, 수요일. 작은 반항에 죽을 위기에 처한 그때, 드디어 찾았군. 하루아침에 오빠가 셋이나 생겨 버렸다. 아스카니어 황가의 저주를 풀 유일한 열쇠가 나라고? 게다가 폭군이라고 불리는 오빠들이 왜 나한테만 다정한건데?! 갑자기 생긴 오빠들의 본격 막내 편애 로맨스, 폭군 오빠가 셋이래요.",카카오웹툰,https://kr-a.kakaopagecdn.com/P/C/2493/c2/2x/223efbd7-1a72-4ff7-ac4a-c8bedf348df9
72,폭군 남편이 달라졌어요,장비,수,로맨스 판타지,"가문에 의해 억지로 폭군 대공과 결혼하게 된 이드리스. 공작가의 사생아였기에 가족의 사랑도 받지 못 했던 그녀는 폭군 대공 칼리드와의 불안한 결혼 생활을 이어간다. 그러던 어느 날, 자객에 의해 급소를 찔린 이드리스는 다시 보자는 영문모를 칼리드의 말과 함께 숨을 거둔다. 정신 차리니 결혼식 당일로 돌아온 이드리스. 그런데 한 번도 웃어주지 않았던 칼리드가 온갖 달콤한 말을 건네오며 그녀를 위해 뭐든 하겠다고 웃어주는데... 갑자기 우리 폭군 남편이... 달라졌어요!",카카오웹툰,https://kr-a.kakaopagecdn.com/P/C/2411/c2/2x/64207c72-6f36-4239-940d-21d781c94a94
73,폭군의 보호자는 악역 마녀입니다,하리,수,로맨스 판타지,"19금 피폐 로맨스 판타지 소설 속 악역, 무시무시한 마녀에 빙의했다. 스토리에 따르면 마녀는 자신이 키운 폭군 남주인공에게 죽는 운명! 다행히도 남주인공이 태어나려면 아직 200년이나 남은 상황. 그럼 느긋하게 대책을 생각해볼까? 그러나 200년은 순식간에 지나갔고. 어느새 내 눈앞에서 벌벌 떨며 서 있는 7세의 어린 남주가 말했다. 제가 갑자기 찾아와서 곤란해지신 거 알아요. 죄송해요. 절 궁으로 돌려 보내셔도 괜찮아요... 뭐야, 이 뽀시래기는...? 어쩌면 나, 조금의 희망은 있는지도?! 음... 우선 잔뜩 겁먹은 이 꼬마부터 달래보자 싶어 내가 할 수 있는 최대한의 상냥함으로 말했다. 어처구니가 없구나. 내가 너 같은 꼬마 하나 때문에 곤란해질 사람으로 보이느냐? 그리고 어딜 돌아가겠다는 거야? 갈.곳.도.없.는.주.제.에. ...! 갑자기 꼬마가 울먹이기 시작했다. ...어라, 이게 아닌가?",카카오웹툰,https://kr-a.kakaopagecdn.com/P/C/2447/c2/2x/50a43911-fbcc-41cd-b3d8-2d6c9d7dcff8
74,나는 될놈이다,서윤교,수,학원/판타지,"모든 걸 완벽하게 소화하며 잘하기에 주인공은 어디서든 될 수 밖에 없는 인재, 그렇기 때문에 게임 안에서 아무도 하지 않는 기행을 하며 정점을 노린다. 될 놈은 되게 되어있다! 엄청난 행운으로 불가능한 퀘스트도 주인공의 행운에는 속수무책. 행운으로 게임을 정복한다!",카카오웹툰,https://kr-a.kakaopagecdn.com/P/C/2339/c2/2x/c1866deb-321e-4cb0-954f-4280eb684930
75,나의 미친 페미니스트 여자친구,오은지,수,로맨스,어쩌다 페미니스트 여자친구와 사귀게 된 남자의 연애분투기,카카오웹툰,https://kr-a.kakaopagecdn.com/P/C/2138/c2/2x/73ddfea2-0327-4993-8b86-c35d3d061732
76,악녀가 사랑할 때,붉구,목,로맨스 판타지,시한부 인생을 사는 악녀에게 빙의했다. 괜찮다. 병은 고칠 수 있으니까! 목표는 하고 싶은 걸 마음껏 하는 인생! 나는 먼저 좋아하던 소설 속 등장인물들 덕질을 하기로 했다. 그런데 나를 악녀라고 하던 주변 사람들 반응이 이상하다. 당신은 곧 죽는데도 어떻게 그렇게 웃으실 수 있는 겁니까. 그야 네가 잘생겨서..?,카카오웹툰,https://kr-a.kakaopagecdn.com/P/C/2417/c2/2x/512df621-92d6-4d1d-9ccc-2781cf96dbba
77,나 혼자만 레벨업,현군,목,학원/판타지,"10여 년 전, 다른 차원과 이쪽 세계를 이어 주는 통로 게이트 가 열리고 평범한 이들 중 각성한 자들이 생겨났다. 게이트 안의 던전에서 마물을 사냥하는 각성자. 그들을 일컬어 헌터 라 부른다. 그러나 모든 헌터가 강한 것은 아니다. 내 이름은 성진우. E급 헌터다. 저급 던전에서조차 죽을 고비를 넘겨야 하는 인류 최약병기 . 무엇 하나 내세울 것 없는 형편에 저급 던전으로 근근이 생계를 이어가던 그는, D급 던전 속에 숨겨진 최악의 난이도의 이중 던전을 만난다. 그리고 결국 죽음을 맞이하려던 순간, 그는 기이한 능력을 얻게 된다. 오직 그에게만 보이는 게임 퀘스트 창! 오직 그만이 알게 된 레벨 업의 비밀! 퀘스트를 따라 수련하고 몬스터를 사냥하면 레벨이 오른다. 오직 그 혼자만! 최약체 헌터에서 최강 헌터로 각성하다!",카카오웹툰,https://kr-a.kakaopagecdn.com/P/C/2320/c2/2x/78363bcd-eec2-4d43-8045-c1f732ad87a1
78,아내가 돌아왔다,신선,목,로맨스,"이혼해요, 우리. 사랑 없는 정략결혼. 결혼은 비즈니스일 뿐이라 생각했던 남자, 최무원. 그런 그에게 이혼을 말한 여자, 이유래. 3년이 지난, 어느 날 예상치 못한 장소에서 낯선 관계로 재회하는데 . 우리 연애할래요? 아내가 돌아왔다. 그런데 이 여자, 그가 알던 예전의 그 여자 맞아? 멈추었던 심장이 뛰기 시작한다. 하필이면 돌아온 아내에게, 아내가 돌아왔다 .",카카오웹툰,https://kr-a.kakaopagecdn.com/P/C/2421/c2/2x/d71d2e21-d28f-4ad6-a59e-ee2bcad876e9
80,마탄의 사수,샤이멜,목,학원/판타지,"부대에서 명사수로 꼽히는 부사관 하이하 는 어느날, 탄통이 폭발하는 사고로 인해 하반신 마비가 되어버린다. 그의 하반신을 원래대로 돌리려면 20억이라는 거금이 필요하다. 절망하며 집에서 침울해하고 있던 중, 사촌동생의 권유로 미들어스 라는 게임을 접하게 된다. 가상 현실게임 미들 어스 에서획득한 돈은 현실의 돈이 된다! 수술비를 벌기위해 미들어스에 뛰어든 이하. 하지만 캐릭터 생성 때 가장 성능이 낮은 머스킷티어 를 고르게 되고 마는데... 흑색 화약, 쇠구슬, 꼬질대. 진짜 머스킷티어 가 뭔지 보여주마!",카카오웹툰,https://kr-a.kakaopagecdn.com/P/C/2470/c2/2x/6b9953cd-30cd-43de-bd99-da9a6f70ca93
81,악당의 아빠를 꼬셔라,비아,목,로맨스 판타지,"주인공들이 태어나지도 않은 책 속 세계에서 눈을 떴다. 게다가 이제부터 부모님 세대에는 초특급 시련들이 닥쳐올 예정! 그러니까 우선 언니의 납치부터 막자...고 생각했는데 잡았다. 르보브니의 공주. 왜 내가 납치된거야?! 대신 납치된 것도 서러운데, 나를 납치한 황제의 곁이 아니면 몸이 버티질 못한다! 아버님, 결혼해주세요! 그래, 이왕 이렇게 된 거 존재 자체로 은혜로운 저 남자도 살리고, 나도 좀 살자!",카카오웹툰,https://kr-a.kakaopagecdn.com/P/C/2378/c2/2x/b1f05b97-c02b-4623-94e5-e3e9487f56d1
82,"아빠, 나 이 결혼 안 할래요!",유리,목,로맨스 판타지,"모두에게 미움받는 악녀 쥬벨리안. 사랑했던 애인도 단 하나뿐인 가족, 아버지에게도 버림받고 쓸쓸히 죽어버린 비참한 악역 쥬벨리안이 바로 나라고? 인생 2회차 이렇게 된 이상 사랑받는 건 텄다! 아버지의 돈으로 꿀이나 빨겠어! 화려한 공녀라이프를 선언했건만, 아니, 아버지! 싸이코패스 황태자가 제 결혼 상대라고요? 방법은 단 하나, 계약 연애뿐! 그리고 상대로는 아버지의 제자가 좋겠다고 결론 내린다. 바로 그 남자가 황태자인 줄 모른 채 .",카카오웹툰,https://kr-a.kakaopagecdn.com/P/C/2472/c2/2x/530cdbf1-de28-49d6-86e0-d2603eb94fbe
83,소설 속 악녀 황제가 되었다,산양,목,로맨스 판타지,"진탕 취했다 잠에서 깨어 보니 소설 속 폭군 황제에게 빙의했다. 사흘 뒤면 반역으로 죽을 예정인 황제 율리아 에게. 전생의 복수도 해야 하고, 반역도 막아야 하는 워커홀릭 황제 폐하의 살길 찾기 프로젝트. 기왕 황제 된 거, 폭군보다 성군이 낫잖아? 의외로 황제 체질. 외강내강 직진형 황제 율리아의 파란만장 제국 통치기!",카카오웹툰,https://kr-a.kakaopagecdn.com/P/C/2404/c2/2x/b488190d-738f-4556-8a13-6210062c8b43
84,지옥에서 돌아온 성좌님,시치,목,학원/판타지,"성좌들이 노리는 땅, 지구. 헌터 최연승은 지구를 독식하려는 성좌들을 막아내고자 특별 수련에 돌입하기로 한다. 수련 장소는 시간이 무한히 느리게 흐르는 공간 어비스. 허나 최연승은 갑자기 마력폭풍에 휘말리고... 급기야 거친 어비스를 정면으로 마주하게 되는데. 어비스 곳곳에서 전례없이 무한한 실전 수련을 거친 최연승은 인간 최초로 성좌가 되는 실마리를 발견한다. 노력형 헌터 최연승은 과연 무사히 성좌로 거듭나, 성좌들의 먹이가 될 운명인 지구를 구할 수 있을 것인가? 노력형 먼치킨 무공 수련자 최연승. 그가 걷는 인간 최초의 성좌가 되는 길!",카카오웹툰,https://kr-a.kakaopagecdn.com/P/C/2483/c2/2x/47b266b0-2c3e-4712-95f0-6061527f59a3
85,옥탑방 소드마스터,김의권,목,학원/판타지,"능광중학교 재학 시절 동급생 8명에게 폭행당해 혼수상태에 빠진 세영, 9개월 만에 깨어나지만 부모님이 자신의 억울함을 풀기 위해 분신자살했다는 것을 알게 된다. 그로 인해 폭행 사건이 재조명 받아 사건을 덮으려 애쓰던 가해자들이 처벌받지만, 세상에 대한 분노와 두려움은 없어지지 않았다. 세영은 철저한 외부와의 단절로 자신을 숨겨버린다. 달이 바뀌고 해가 바뀌고 계절이 바뀌어도 문밖을 나서본 적이 없던 어느 날, 갑자기 이상한 소리가 들려 문을 열고 밖을 나가는데.. 옥상 정중앙에 꽂혀 있는 거대한 검 싸우는 검 그리고 그 검을 통해 신의 목소리가 전해 들려온다. 강해지는 법은 간단해. 검을 들고 뛰어. 그리고 휘둘러. 지칠 때까지. 그것뿐이다. 세영, 그의 통쾌한 복수가 시작된다.",카카오웹툰,https://kr-a.kakaopagecdn.com/P/C/2380/c2/2x/2220c447-7858-4c19-995b-2c68edd8e2b2
86,괴물 공작가의 계약 공녀,민작,목,로맨스 판타지,언니의 삶에 희생되기 위해 태어난 레슬리. 더이상 타인에게 휘둘리는 삶이 아닌 자기 자신을 위한 삶을 살기 위해 괴물 공작가 라고 불리는 셀바토르 가문에 찾아가 자신을 양녀로 입양해 제국 유일한 공녀로 만들어 달라는 요청과 함께 세계 최고의 어둠술사를 주겠다는 거래를 제안한다.,카카오웹툰,https://kr-a.kakaopagecdn.com/P/C/2336/c2/2x/a4e2081b-3379-4cd2-bb8a-e983b9d0fe03
87,그냥 악역으로 살겠습니다,대전환,목,로맨스 판타지,"책 속 악역, 공작 영애에 빙의했다! 감히 여주인공을 죽이려한 살인미수범이 이 몸의 주인이라고? 기왕 이렇게 된 거 조용한 곳에서 놀고먹으며 막 살자! 고 생각한 것도 잠시. 벌로 쫓겨난 북방의 이곳은 너무너무너무 추웠다. 얼어 죽기 전에 불꽃의 대악마를 불러내 벽난로에 불을 지폈는데 쟤 왜 안 돌아가? 할 일 다 했으면 가야 하는 거 아냐?! 불 피우려다 악마와 종신계약 한 것도 당황스러운데 욕구 해소 ? 까지 책임지라니! 대형 멍멍이 악마님과 부스러기 악역 영애님의 티격태격 로맨스 그냥 악역으로 살겠습니다",카카오웹툰,https://kr-a.kakaopagecdn.com/P/C/2475/c2/2x/48660fd2-c88c-4678-a358-2432d1bfecc2
88,킬 더 히어로,만화인생,목,학원/판타지,"어느 날 갑자기 게임처럼 변해버린 세상. 던전에서 몬스터가 쏟아져 나오고 그들을 상대하는 플레이어가 생겨났다. 그리고, 혜성처럼 등장한 구원자, 이세준. 나는 그의 동료가 되었다. 하지만 그동안 수고했다. 네가 아니었다면 여기까지 올 수 없었겠지. 최후의 던전에서 나는 이세준의 칼에 목숨을 잃었다. 죽음의 순간, 내 귓가에 들려온 알림음. 게임을 시작합니다. 나는 플레이어로 각성하기 전의 과거로 되돌아 왔다. 이제는, 내가 널 사냥 할 차례다.",카카오웹툰,https://kr-a.kakaopagecdn.com/P/C/2376/c2/2x/76d6aef2-c809-4954-878e-24344c49853a
89,도사강호,김달해,목,액션/무협,"데이트 중 갑작스런 사고에 눈 떠보니 사극 촬영장?! 아니, 아기 도사로 다시 태어났잖아! 한때는 구파일방이었지만, 지금은 세가 약해진 종남파에서 건청 이라는 이름을 받고, 전생의 지식을 이용해 무공의 이치를 깨닫는다. 시각이 다르면 무공도 다르다. 무재는 아니지만, 지식을 가진 기재! 생사도협 건청의 신개념 강호정벌기! 지금 시작합니다!",카카오웹툰,https://kr-a.kakaopagecdn.com/P/C/2441/c2/2x/f699a026-a3f7-4d06-8268-6c653bedad5c
90,일상생활 가능하세요?,시녹,목,로맨스,"유일 호텔의 대표이사 이호진. 외모, 집안, 능력 모두 뛰어난데다가 겸손하고 예의까지 바르다! 그런 그의 천적은 동갑내기 사촌 이영준. 다른 이에게 향할 관심과 스포트라이트까지 죄다 가져가 버리는 얄미움의 최종 보스 그를 멕이기 위해. 호진은 영준이 가지지 못한 미술 작품을 손에 넣으려 한다. 그러려면 그림 주인의 막내딸 한서정의 남편 자리를 꿰차야 하는데....... 김비서가 왜 그럴까 의 스핀오프 정경윤 소설, 웹툰으로 찾아온다.",카카오웹툰,https://kr-a.kakaopagecdn.com/P/C/2471/c2/2x/aff46cd8-5d2f-4c08-a9ec-beb3da734a0b
91,다른 세계에서 주워왔습니다,가비뚜,목,학원/판타지,"낯선 곳에서 눈을 떴다. 폐허가 된 주변, 뼈만 남겨진 군인의 시체. 이곳은 멸망한 서울!!!! 이대로 멸망한 세계처럼 되는 건 시간문제?! 다른 세계에서 단서를 찾아, 멸망을 막아야 한다.",카카오웹툰,https://kr-a.kakaopagecdn.com/P/C/2408/c2/2x/dd8d8670-3b58-4e7a-a5d5-50060f271144
92,유리온실의 공작 부인,공기알,목,로맨스 판타지,"당신 인생을 살아. 맥없이 휘둘리며 남에게 내어주지 말고. 에드하르가 내게 해준 말은 참으로 제멋대로였으나 묘하게 나를 울려대었다. 하지만 그와의 결혼 생활은 불행에 가까웠고, 소중한 아이마저 빼앗긴 채 나는 초라한 별채에서 쓸쓸히 죽음을 맞이했다. 모든 것을 포기했을 때 감사하게도 다시 주어진 두 번째 삶. 나는 나에게 주어진 기회를 제 것으로 만들겠노라 다짐했다. 눈을 감으면 과거의 일들이 선연하지만, 이젠 도망치지 않고 직시하겠어. 나와 내 아이를 지키기 위해!",카카오웹툰,https://kr-a.kakaopagecdn.com/P/C/2478/c2/2x/a1edc359-a556-4351-bd00-e395c7fca698
94,화룡왕,옥돔,목,액션/무협,어려서부터 남들과는 다른 눈으로 세상을 바라볼 수밖에 없었던 서문무휘. 뜻하지 않게 강호로 나가게 된 그의 붓끝에서 새로운 세상이 펼쳐진다!,카카오웹툰,https://kr-a.kakaopagecdn.com/P/C/2452/c2/2x/f279b2b2-61ee-491e-aba6-0c0118c9fd4f
95,프로레슬링의 신,COBY,목,판타지 드라마,"누구보다 프로레슬링을 사랑하지만, 인종의 한계를 넘지 못한 준호킴. 성과 없는 은퇴 후 공사장 잡부로 일하던 와중 불의의 사고에 휘말리고 눈을 떠보니 WWF 입사 시험 전날로 돌아왔다?! 이번엔 내 커리어를 승률 0.7 의 악역 쿵 퓨리로 끝내지 않겠어! 죽도록 구르며 배운 기술들과 미래에 대한 정보를 가진 채 20대의 몸으로 회귀했다. 커리어 내내 패배 전문 악역 자버 Jobber 로 구르던 역사를 반복하지 않겠다. 앞으로 한 시대를 풍미할 레슬러들과 함께 프로레슬링계의 역사를 다시 쓴다. 시대의 아이콘 이라 불리는 프로레슬링의 신이 되기 위해!",카카오웹툰,https://kr-a.kakaopagecdn.com/P/C/2458/c2/2x/ce21300f-fed3-46a0-b4b3-797e7b015427
96,황제의 외동딸,리노,목,로맨스 판타지,"아리아드나 레르그 일레스트리 프레 아그리젠트. 겁나 긴 이름으로 시작한 새로운 내 인생 그러나 대체 이건 무엇이란 말인가. 나름 귀한 신분으로 태어났음에도 태어날 때부터 온갖 동정 어린 시선은 다 받고 태어났으니 그 이유는 단 하나 바로 내 아버지라는 작자 때문이었다. 아버지가 미친놈이시라면서요? 반역으로 피로 얼룩진 옥좌에 올라선 반왕, 대륙을 공포로 몰아넣은 희대의 폭군. 나 과연 살아남을 수는 있을까? 이 황제는 아주 위험한 생물입니다. 하지만 지금은 내 아빠죠. 아, 나!",카카오웹툰,https://kr-a.kakaopagecdn.com/P/C/2303/c2/2x/f963652d-b05e-4fad-88a1-e0953bfbd747
97,마존현세강림기,"Azi, UGPP",금,학원/판타지,첫 번째 삶. 불의의 사고로 가족과 두 다리를 잃고 스스로 목숨을 끊었다. 두 번째 삶. 중원에서 적천마존이라는 명성을 얻었지만 가장 신뢰하던 이에게 배신당해 죽게 됐다. 그리고 맞게 된 세 번째 삶. 다시 돌아온 현대에서 강진호 자신은 평범한 삶을 살 거라 다짐하지만... 평범한 인간으로 살기엔 이미 중원의 삶에 너무 익숙해져 버린 것 ! 난 평범하게 살고 싶었어. 하지만 먼저 날 건드린 건 너희들이다. 각오는 돼 있겠지? 다가오는 위기 속에서 강진호는 적천마존으로서의 충동을 떨쳐내고 무사히 평범한 삶 을 얻을 수 있을 것인가 ! 전설이라 불린 마교 교주의 21세기 현세 적응기 !,카카오웹툰,https://kr-a.kakaopagecdn.com/P/C/2350/c2/2x/30a9240a-5f4c-4987-9956-3d787cacb302
98,SSS급 죽어야 사는 헌터,네이다,금,학원/판타지,"F급 말단 헌터 김공자 . 랭킹 1위 염제 를 부러워하던 어느 날, 무려 S 급 스킬을 얻는다. 하지만 기쁨도 잠시, 어째 스킬 내용이 이상하다?! 상대의 스킬 중 1개를 복사한다,까지는 좋은데 뭐? 내가 죽어야만 발동된다고?! 죽어야 사는 헌터의 인간찬가 SSS급 죽어야 사는 헌터",카카오웹툰,https://kr-a.kakaopagecdn.com/P/C/2454/c2/2x/133d3337-40bf-4005-823d-25a14f06fe6b
99,매달려도 소용없어,고래,금,로맨스 판타지,"사랑하는 남자, 라칸을 위해 내 모든 것을 바쳐 그를 황제로 만들었다. 그리고 드디어 오늘, 나는 그의 곁에서 황후가 될 것을 기대했건만, 황후의 관은 내가 아닌 나의 사촌 여동생, 비에나의 것이 되었다. 목숨까지 바쳐가며 희생한 내게 남은 것은 독에 중독되어 죽어가는 몸 뿐이라니. 대체 어디서부터 잘못된 걸까 버려지고 나서야 이용당했다는 것을 깨달았다. 그렇게 죽는 순간 다짐했다. 만약 또 한 번의 기회가 있다면 죽어도 라칸, 너만은 사랑하지 않을 것이라고. 그렇게 열여덟 살. 모든 것이 시작되었던 그날로 돌아왔다. 내 모든 것을 앗아간 라칸, 이번엔 널 처참히 망가뜨려 줄게. 라칸이 아닌, 과거 황제가 억지로 묶어 놓았던 나의 약혼자 페일론. 그를 반드시 황제로 만들 것이다. 페일론, 사랑 따위 필요 없어요. 계약 하나 하죠. 제 편이 되어 주세요. 그렇게 해주신다면 반드시 내가 당신을 황제로 만들 것입니다. 비에나, 라칸. 둘 다 나락으로 떨어뜨려 줄게. 이젠 매달려도 소용없어.",카카오웹툰,https://kr-a.kakaopagecdn.com/P/C/2491/c2/2x/9e56689f-f556-48c4-8a80-7effe1873ab0
100,낙화유수,RYU,금,로맨스,"하루 하루 한의사로서 치열한 나날을 보내던 김소진. 그러나 예상치 못한 화재사고로 목숨을 잃게 된 그녀는 다시 눈을 떴을 때 자신이 고구려 시대, 절노부 연씨 가문의 우희 가 되었다는 것을 알게 된다. 귀한 가문의 딸로 태어났지만, 이곳은 매일같이 전쟁이 벌어지는 고구려 시대! 게다가 이제 갓 열두 살일 뿐인데, 나를 정치적인 목적으로 정략 결혼을 시키겠다고? 게다가 하필이면 그 결혼상대가 대한민국 사람들이라면 모두 알고 있는 바로 그 광개토대왕 ? 전...전 태자님이랑 혼인 안할겁니다! 역사상 가장 위대했던 태왕, 그리고 미래 를 기억하는 여자 우희가 꽃피우는 연애담.",카카오웹툰,https://kr-a.kakaopagecdn.com/P/C/2492/c2/2x/d1a7c88f-a785-490f-a70c-755f725fe09a
101,화홍,서윤영,금,로맨스,"1부 단국의 고고하고 잘난 욱제 전하, 어리고 못난 소혜 아씨를 중전으로 맞이하였도다. 허나 욱제 전하, 잉첩인 희란 만 어여삐 여기고, 조강지처 소혜 아씨, 소박만 주는구나. 외롭고 힘든 궁궐 생활 홀로 버텨내던 중전마마, 이제 회임할 수 있는 진짜 여인이 되었으니! 어느 순간 욱제 전하의 눈길이 중전마마에게로 향하는 것인데 두 지존마마, 과연 귀한 사랑의 결실을 이룰 수 있을 것인가? 로맨스 장편 소설의 대가 이지환 작가의 원작 화홍 이 본격 궁중 로맨스 만화로 재탄생!!! 2부 욱제 전하와 소혜 마마 슬하 네 분의 왕자님과 두 분의 공주를 두셨으니, 이는 단국의 큰 복이라 장성하시어 세자빈을 맞이할 보령되신 단국의 세자저하, 예전부터 맘에 품었던 처자 연희 아씨 계셨으나 연희 아씨 성정 보통 아니라. 세자빈 되겠노라 저하와 약조해두곤 도망치기 일쑤로구나. 겨우겨우 세자빈 간택은 되었으나 간택된 날조차도 궐 담 넘겠다 아둥바둥하던 연희 아씨, 미리 아씨를 기다리고 있던 세자저하에게 보쌈당해버리니! 그 밤에 세자저하와 연희 아씨 과연 무슨 일이 있었으려나 ?! 더욱 화려하고 더욱 색 스러워진 화홍 2부! 각양각색 스타일의 구중궁궐 연애담을 지금 만나보세요",카카오웹툰,https://kr-a.kakaopagecdn.com/P/C/2313/c2/2x/749d1753-6f22-4fb4-b472-f17bfb82be0a
103,두 번 사는 랭커,농농,금,학원/판타지,"5년 전 사라진 쌍둥이 동생을 잊고 살던 연우. 어느날 그에게 동생의 유품인 회중시계가 돌아왔다. 그리고 그 속에 숨겨진 일기장. 형이 이 일기를 들을 때 즈음이라면 나는 이미 이 세상 사람이 아니겠지. 여러 차원과 우주가 교차하는 세계에 놓인 태양의 신 탑, 오벨리스크. 그리고 그곳에 오르다 배신당해 눈을 감아야 했던 동생. 모든 걸 알게 된 연우는 동생이 남겨 둔 일기와 함께 탑을 오르기 시작한다. 오늘부터 난. 차정우이다.",카카오웹툰,https://kr-a.kakaopagecdn.com/P/C/2335/c2/2x/b9fe0ce6-cb1a-451b-9e75-577ebf0bb31e
104,남편이 미모를 숨김,가비남,금,로맨스 판타지,"대대로 끔찍한 괴물이 태어난다는 할스테드 성의 영주, 에르덴. 흉측하기로 유명한 영주의 외모는 가면으로 가려져 있다. 언니들 대신 할스테드 성의 영주에 시집가게 된 레티샤는 괴물과 결혼한 여인 으로 불리며 많은 이들의 동정을 사지만 사람들은 모르는 비밀이 있다. 부인께는 항상 감사해하고 있습니다. 흉측한 저에게 이렇게나 상냥하시다니 그야 전 에르덴의 부인이니까요. 어서 빨리 이혼해드려 하루 빨리 이 모든 것들로부터 벗어나도록 해드려야 하는데 죄송하지만 이혼장을 잃어버린 것 같습니다. 그렇겠지, 내가 태워버렸으니까. 그래서 시간이 더 걸릴 것 같습니다. 법률가들 사이에 소문 좀 험하게 흘려놔야겠군. 이렇게 잘생긴 남편과 이혼이라니. 안 돼, 안 돼, 절대 안 돼!!!",카카오웹툰,https://kr-a.kakaopagecdn.com/P/C/2406/c2/2x/b12966b3-98ec-4c01-92a3-29a0119cbe28
