,title,day,genre,story,platform
115,연화전,화,드라마만화,"낮에는 엿장수 39 춘복 39 , 밤에는 의적 39 백일도 39 이중생활을 하는 연화에게는 특별한 능력이 있다. 상대방에게 손바닥을 대면, 그의 기억을 읽을 수 있는 능력! 연화는 이 능력으로 어머니의 죽음에 대한 단초를 찾아 헤매다 사라진 줄 알았던 사교 집단 39 밀영교파 39 와 조우하는데...! 34 진실을 알고 죽고 싶으냐, 아무것도 모른 채 오래 살고 싶으냐? 34 날쌘 몸놀림과 기억을 읽는 능력을 지닌 연화. 뛰어난 무공의 소유자이지만 불우한 서얼인 박이현. 여덟 차례 어사화를 쓴 출중한 두뇌의 김준. 이들이 펼치는 조선시대 미스터리 활극! 연화전",카카오페이지
116,리더(Reader)-읽는자,화,소년만화,"활자중독자, 수혁. 책을 읽기 위해 시작한 가상현실게임 39 판게아 39 . 수혁은 책의 마지막 장을 읽고 덮었다. 바로 그때, 책의 반짝임이 사라지며 메시지가 나타났다. 지혜가 1 상승 합니다 강철민 작가님의 인기 판타지 소설 리더 읽는 자 를 웹툰으로 만나보세요!",카카오페이지
117,익애 ~봉황애사~,화,로맨스만화,"딸을 낳아 바치는 것을 대가로 대대로 부귀영화를 이어온 최씨 가문. 인간인지 무엇인지 정체모를 사내와 터무니없는 약속을 한 최씨 일가는 여자아이가 태어나 사내와의 약속이 이루어지면 부귀영화를 잃을 것을 걱정해 딸을 낳는 것을 금기시한다. 그런 최씨 일가에서 유일한 여자아이로 태어난 지환은 여자라는 이유만으로 일가친척의 모진 구박을 받으며 살다 급기야 목숨의 위협을 느껴 집을 나온다. 약속을 기다리던 사내는 최씨 일가에 약속한 딸을 내 놓으라며 찾아가고, 지환은 할아버지의 장례식장에서 쓰러진 청년을 보고 이상한 이끌림을 느껴 도와주는데?! 과거의 인연을 다시 잇기 위해 움직이기 시작한 두 사람의 이야기, 사이다 여주가 활약하는 강렬한 동양 판타지!! 마법수프 김공작 작가의 동양풍 판타지 로맨스!",카카오페이지
118,보이즈 립스틱,화,로맨스만화,유명 뷰티크리에이터 인 태화는 누군가에게 쫒겨 청운고등학교에 남장을 한 채 전학오게 된다. 사람의 감정의 색을 눈으로 보는 공감각능력자 윤강은 태화의 감정의 색에 관심을 가지게 되고 여러 사건들로 태화는 윤강에게 정체를 들키게 된다. 윤강은 태화의 뷰티크리에이터 작업을 도와주며 그림이외에는 처음으로 메이크업에 흥미를 느낀다. 이들의 관계를 흥미롭게 지켜보고 있는 이든과 이솔. 자신의 힘으로 꿈을 찾고 이루려는 청춘들의 이야기.,카카오페이지
119,마족의 계약,화,로판만화,"마왕의 딸인 유리시나는 처음 성인이 되고 나서 인간과 혼을 담보로 계약을 맺어 당당한 마족으로 인정 받고 싶어 한다. 그때, 페드인 왕국의 공주 마리엔이 그녀를 소환하게 되고 자신을 독살한 오펠리우스 왕비에게 복수하고자 대신 살아 달라고 부탁하는데 .",카카오페이지
120,마녀를 지켜라,화,소년만화,"이공계 출신 직장인 정현은 과도한 업무로 돌연사하며, 다른 세계로 이동하게 된다. 그 세계에서 정현은 39 로랜드 윔블던 39 이라는 왕자로 불리게 되고, 사형을 앞둔 안나 라는 마녀를 구해내는데 로랜드가 된 정현, 그는 과연 치열한 왕위 쟁탈전에서 살아남을 수 있을까?",카카오페이지
121,나는 남주의 전 여친이었다,화,로판만화,"역하렘 소설 속 악역 조연에 빙의했다! 내 역할은 여주가 나타나면, 남주에게 차이는 역할. 요컨대 남주에게 매달리는 구질구질한 전 여친이었다. 나는 멍청한 악역 조연이 되기를 바라지 않았기에, 내가 먼저 남주를 차고서 그와 거리를 뒀는데 . 3년 후, 내 앞에 다시 나타난 남주가 어째 심상치 않다. 너 없이는 안 될 것 같아. 여전히 좋아해. 난 네가 집착해야 할 여주가 아닌데? 그리고 우연히 친해지게 된 남주의 절친인 시온느. 서브 남주인 그의 운명이 가엾어, 나는 그를 자주 위로해 주었다. 하지만 위로를 너무 많이 해 주었던 걸까? 네가 좋아. 좋아해. 더 좋아질 것 같아. 난 네가 좋아해야 할 여주가 아닌데? 악역 조연에 불과한 내게, 여주의 남자들이 줄줄이 고백하기 시작했다. 나는 누구를 선택해야 하는 걸까?",카카오페이지
122,그 아가씨의 집사님,화,로판만화,"소설 꽃을 들었다 의 서브남주의 주식을 산 서우리는 평소처럼 열심히 정주행을 한 후 여느 때처럼 1인 1 란슬롯을 주장하는 댓글을 남기고 잠이 들었다. 그런데 뭔가 이상하다?! 잠에서 깨어보니 내 최애캐 가 날 아가씨. 라고 부르며 방긋 웃고 있다! 아무래도 로또를 맞은 게 분명해. 아니면 전생에 우주를 구했던가. 그런 게 아니면 이런 일이 일어날 리가 없잖아? 기왕 탄 로또, 제대로 써야겠다. 나는 결심했다. 최애캐 의 행복을 최우선으로 하겠다고.",카카오페이지
